{
  "contactName": "Newie",
  "contactTitle": "CFO",
  "contactEmail": "firstname.lastname@company.co.uk",
  "contactPhone": "(512) 757-6000",
  "accountName": "",
  "accountPhone": "(512) 987-1234",
  "contactMobile": "(512) 757-6000",
  "accountParent": "",
  "rating": "Medium",
  "accountNumber": "CD123456",
  "website": "http://private-consulting.com",
  "accountSite": "",
  "tickerSymbol": "EDGE",
  "accountType": "Customer - Direct",
  "accountOwnership": "Private",
  "industry": "Consulting",
  "noOfEmployees": "500,000",
  "annualRevenue": "100,000,000",
  "currencyRevenue": "Â£",
  "sicCode": "9000",
  "accountBillingNumberStreet": "1",
  "accountBillingStreet": "Headstone Rd",
  "accountBillingCity": "Harrow",
  "accountBillingCountry": "United Kingdom",
  "accountBillingPostCode": " HA1 1NL",
  "accountShippingNumberStreet": "31A",
  "accountShippingStreet": "Park Road",
  "accountShippingCity": "London",
  "accountShippingCountry": "United Kingdom",
  "accountShippingPostCode": "E15 3QP",
  "accountCustomerPriority": "High",
  "accountSLA": "Gold",
  "accountSLAExpirationDate": "31/12/2016",
  "accountSLASerialNumber": "7562",
  "accountNumberOfLocations": "2",
  "accountUpsellOpportunity": "Maybe",
  "accountActive": "Yes",
  "accountSLASerialNumber": "(408)326-9000"  
}