{
  "contactName": "",
  "contactTitle": "",
  "contactEmail": "firstname.lastname@company.co.uk",
  "contactPhone": "????",
  "accountName": "????",
  "accountPhone": "????",
  "contactMobile": "????",
  "accountParent": "????",
  "rating": "????",
  "accountNumber": "????",
  "website": "????",
  "accountSite": "????",
  "tickerSymbol": "????",
  "accountType": "????",
  "accountOwnership": "????",
  "industry": "????",
  "noOfEmployees": "????",
  "annualRevenue": "????",
  "currencyRevenue": "????",
  "sicCode": "????",
  "accountBillingNumberStreet": "????",
  "accountBillingStreet": "????",
  "accountBillingCity": "????",
  "accountBillingCountry": "????",
  "accountBillingPostCode": "????",
  "accountShippingNumberStreet": "????",
  "accountShippingStreet": "????",
  "accountShippingCity": "????",
  "accountShippingCountry": "????",
  "accountShippingPostCode": "????",
  "accountCustomerPriority": "????",
  "accountSLA": "????",
  "accountSLAExpirationDate": "????",
  "accountSLASerialNumber": "????",
  "accountNumberOfLocations": "????",
  "accountUpsellOpportunity": "????",
  "accountActive": "????"
}